1,Renew Chebula Active Serum,True Botanicals ,Face & Body,Face,Anti Aging
2, Notox Daily Cream,The Cleanest Lab,Face & Body,Face,Anti Aging
3, Oceanly Phyto-Age Face Serum,ATTITUDE,Face & Body,Face,Anti Aging
4, Beauty Dark Spot Corrector,DIME,Face & Body,Face,Anti Aging
5, Firm Believer Goji Stem Cell + Pomegranate Smoothing Neck +...,Three Ships,Face & Body,Face,Anti Aging
6, Repair,W/O,Face & Body,Face,Anti Aging
7, Berry Bright Vitamin C Eye Cream,Kora Organics,Face & Body,Face,Anti Aging
8, Vitamin C Serum,Kleem Organics,Face & Body,Face,Anti Aging
9, Revitalizing Dark Spot Serum,DrLouie,Face & Body,Face,Anti Aging
10, Stem Cellular Anti-Wrinkle Overnight Cream,Juice Beauty,Face & Body,Face,Anti Aging
11, Daytime Antioxidant Serum,Sally B's Skin Yummies,Face & Body,Face,Anti Aging
12, Bulgarian Rose Intensive Lifting Spot,isoi,Face & Body,Face,Anti Aging
13, Moisturizer 6 (M6),Vermont Skincare Company,Face & Body,Face,Anti Aging
14, Vitamin C Serum,DrLouie,Face & Body,Face,Anti Aging
15, Oceanly Phyto-Age Eye Cream,ATTITUDE,Face & Body,Face,Anti Aging
16, Neck & Decollete Firming Cream,Kleem Organics,Face & Body,Face,Anti Aging
17, Refixion Sans Retinol Creme,Sonage,Face & Body,Face,Anti Aging
18, Beauty TBT Cream,DIME,Face & Body,Face,Anti Aging
19, Nourishing Cream,Alder New York,Face & Body,Face,Anti Aging
20, The Afterglow,Prima,Face & Body,Face,Anti Aging
21, Oceanly Phyto-Age Night Cream,ATTITUDE,Face & Body,Face,Anti Aging
22, Anti-wrinkle Serum,Vika's Essentials,Face & Body,Face,Anti Aging
23, Bulgarian Rose Intensive Perfect Anti-aging Program,isoi,Face & Body,Face,Anti Aging
24, Bulgarian Rose Intensive Treatment Essence,isoi,Face & Body,Face,Anti Aging
1,Renew Chebula Active Serum,True Botanicals ,Face & Body,Face,Anti Aging
2, Notox Daily Cream,The Cleanest Lab,Face & Body,Face,Anti Aging
3, Oceanly Phyto-Age Face Serum,ATTITUDE,Face & Body,Face,Anti Aging
4, Beauty Dark Spot Corrector,DIME,Face & Body,Face,Anti Aging
5, Firm Believer Goji Stem Cell + Pomegranate Smoothing Neck +...,Three Ships,Face & Body,Face,Anti Aging
6, Repair,W/O,Face & Body,Face,Anti Aging
7, Berry Bright Vitamin C Eye Cream,Kora Organics,Face & Body,Face,Anti Aging
8, Vitamin C Serum,Kleem Organics,Face & Body,Face,Anti Aging
9, Revitalizing Dark Spot Serum,DrLouie,Face & Body,Face,Anti Aging
10, Stem Cellular Anti-Wrinkle Overnight Cream,Juice Beauty,Face & Body,Face,Anti Aging
11, Daytime Antioxidant Serum,Sally B's Skin Yummies,Face & Body,Face,Anti Aging
12, Bulgarian Rose Intensive Lifting Spot,isoi,Face & Body,Face,Anti Aging
13, Moisturizer 6 (M6),Vermont Skincare Company,Face & Body,Face,Anti Aging
14, Vitamin C Serum,DrLouie,Face & Body,Face,Anti Aging
15, Oceanly Phyto-Age Eye Cream,ATTITUDE,Face & Body,Face,Anti Aging
16, Neck & Decollete Firming Cream,Kleem Organics,Face & Body,Face,Anti Aging
17, Refixion Sans Retinol Creme,Sonage,Face & Body,Face,Anti Aging
18, Beauty TBT Cream,DIME,Face & Body,Face,Anti Aging
19, Nourishing Cream,Alder New York,Face & Body,Face,Anti Aging
20, The Afterglow,Prima,Face & Body,Face,Anti Aging
21, Oceanly Phyto-Age Night Cream,ATTITUDE,Face & Body,Face,Anti Aging
22, Anti-wrinkle Serum,Vika's Essentials,Face & Body,Face,Anti Aging
23, Bulgarian Rose Intensive Perfect Anti-aging Program,isoi,Face & Body,Face,Anti Aging
24, Bulgarian Rose Intensive Treatment Essence,isoi,Face & Body,Face,Anti Aging
25, Eye Cream 7 (E7),Vermont Skincare Company,Face & Body,Face,Anti Aging
26, Booster Serum,Oyu,Face & Body,Face,Anti Aging
27, Oceanly Phyto-Age Face Cream,ATTITUDE,Face & Body,Face,Anti Aging
28, Rose: Anti-Aging Serum and Complete Moisturizer,Pomifera,Face & Body,Face,Anti Aging
29, Pure: Anti-Aging Serum and Complete Moisturizer,Pomifera,Face & Body,Face,Anti Aging
30,Browlift Reusable Wrinkle Smoothing Patches,Sio ,Face & Body,Face,Anti Aging
31,Facelift Reusable Wrinkle Smoothing Patches,Sio ,Face & Body,Face,Anti Aging
32, PHLORETIN CF WITH FERULIC ACID,SkinCeuticals,Face & Body,Face,Anti Aging
33,Necklift Reusable Wrinkle Smoothing Patches,Sio ,Face & Body,Face,Anti Aging
34,Super Eyelift Reusable Wrinkle Smoothing Patches,Sio ,Face & Body,Face,Anti Aging
35,"11's Lift Reusable Wrinkle Smoothing Patches, Mid Brow",Sio ,Face & Body,Face,Anti Aging
36, Organic Aloe Vera Gel Jasmine (16oz) All Natural - ZERO...,Pura D'or,Face & Body,Face,Anti Aging
37, Rejuvenate Anti-Aging Oil,Argie Essentials,Face & Body,Face,Anti Aging
38,Eye & Smile Lift Reusable Wrinkle Smoothing Patches,Sio ,Face & Body,Face,Anti Aging
39,Neck Chest Reusable Wrinkle Smoothing Patches,Sio ,Face & Body,Face,Anti Aging
40,Chest Reusable Wrinkle Smoothing Patches,Sio ,Face & Body,Face,Anti Aging
41,Superlift Pack Brow Eye Smile Reusable Wrinkle Smoothing Patches,Sio ,Face & Body,Face,Anti Aging
42,Super Liplift Reusable Wrinkle Smoothing Patches,Sio ,Face & Body,Face,Anti Aging
43,SpaScriptions Collagen Hydrogel Lip Mask,,Face & Body,Face,Anti Aging
44,180 Degree Essentials Skincare Daytime Fine Line Wrinkle Complex,,Face & Body,Face,Anti Aging
45,", Firming Anti Wrinkle Neck Cream, Peptides & hyaluronic acid",Global Beauty Care,Face & Body,Face,Anti Aging
46, Prevent Anti-Aging Face Oil,Naked & Thriving,Face & Body,Face,Anti Aging
47,Klein Becker Anti-Wrinkle Intensive Eye Concentrate Plus,Klein-Becker,Face & Body,Face,Anti Aging
48, Collection Targeted Anti-Aging Bakuchiol Serum,Sephora,Face & Body,Face,Anti Aging
